{
  "$schema": "http://json-schema.org/draft-07/schema#",
  "title": "OntologyNode",
  "type": "object",
  "required": ["id", "label", "level"],
  "properties": {
    "id": {
      "type": "string",
      "description": "Unique identifier, kebab-case. VD: 'mcp-authentication'"
    },
    "label": {
      "type": "string",
      "description": "Tên hiển thị. VD: 'MCP Authentication'"
    },
    "level": {
      "type": "integer",
      "enum": [0, 1, 2, 3, 4],
      "description": "0=Domain, 1=Category, 2=Topic, 3=Sub-topic, 4=Detail"
    },
    "description": {
      "type": "string",
      "description": "Mô tả ngắn 1-2 câu"
    },
    "docLink": {
      "type": "string",
      "description": "Relative link tới bài docs trên site (nếu có). VD: '/docs/azure-ai-agent/02-tools/mcp-server-client'"
    },
    "sourceRef": {
      "type": "string",
      "description": "Path tới source doc gốc (để trace provenance)"
    },
    "tags": {
      "type": "array",
      "items": { "type": "string" },
      "description": "Tags phân loại. VD: ['compute', 'serverless', 'beginner']"
    },
    "children": {
      "type": "array",
      "items": { "$ref": "#" },
      "description": "Danh sách concept con (recursive)"
    },
    "relations": {
      "type": "array",
      "items": {
        "type": "object",
        "properties": {
          "targetId": { "type": "string" },
          "type": {
            "type": "string",
            "enum": ["depends-on", "related-to", "alternative-to", "part-of"]
          }
        }
      },
      "description": "Cross-references giữa các node không phải parent-child"
    }
  }
}
